{
  "$schema": "https://json-schema.org/draft/2020-12/schema",
  "$id": "https://example.com/claude-cheat-code/commands.schema.json",
  "title": "Claude Cheat Code Commands",
  "type": "object",
  "additionalProperties": false,
  "required": ["version", "lastUpdated", "categories", "entries"],
  "properties": {
    "version": { "type": "string", "pattern": "^[0-9]+\\.[0-9]+\\.[0-9]+$" },
    "lastUpdated": { "type": "string", "format": "date" },
    "categories": {
      "type": "array",
      "minItems": 1,
      "items": {
        "type": "object",
        "additionalProperties": false,
        "required": ["id", "label"],
        "properties": {
          "id": { "type": "string", "pattern": "^[a-z][a-z0-9-]*$" },
          "label": { "type": "string", "minLength": 1 },
          "icon": { "type": "string" }
        }
      }
    },
    "entries": {
      "type": "array",
      "items": {
        "type": "object",
        "additionalProperties": false,
        "required": ["id", "category", "name", "description"],
        "properties": {
          "id": { "type": "string", "pattern": "^[a-z][a-z0-9-]*$" },
          "category": { "type": "string", "pattern": "^[a-z][a-z0-9-]*$" },
          "name": { "type": "string", "minLength": 1 },
          "syntax": { "type": "string" },
          "description": { "type": "string", "minLength": 1 },
          "example": { "type": "string" },
          "notes": { "type": "string" },
          "since": { "type": "string" },
          "tags": { "type": "array", "items": { "type": "string" } },
          "docs": { "type": "string", "format": "uri" }
        }
      }
    }
  }
}
