{
  "version": "1.1.0",
  "lastUpdated": "2026-04-29",
  "categories": [
    { "id": "slash",     "label": "Slash Commands", "icon": "/" },
    { "id": "cli",       "label": "CLI",            "icon": ">_" },
    { "id": "shortcuts", "label": "Keyboard",       "icon": "K" },
    { "id": "hooks",     "label": "Hooks",          "icon": "H" },
    { "id": "mcp",       "label": "MCP",            "icon": "M" },
    { "id": "agents",    "label": "Agents",         "icon": "A" },
    { "id": "skills",    "label": "Skills",         "icon": "S" },
    { "id": "settings",  "label": "settings.json",  "icon": "C" },
    { "id": "env",       "label": "Env Vars",       "icon": "$" }
  ],
  "entries": [
    {
      "id": "slash-help",
      "category": "slash",
      "name": "/help",
      "syntax": "/help",
      "description": "Show available commands and usage hints inside Claude Code.",
      "example": "/help",
      "tags": ["basics", "discovery"],
      "docs": "https://code.claude.com/docs/en/commands"
    },
    {
      "id": "slash-clear",
      "category": "slash",
      "name": "/clear",
      "syntax": "/clear",
      "description": "Clear the conversation and start fresh, preserving instructions from CLAUDE.md.",
      "tags": ["context", "session"],
      "docs": "https://code.claude.com/docs/en/commands"
    },
    {
      "id": "slash-model",
      "category": "slash",
      "name": "/model",
      "syntax": "/model",
      "description": "Switch the active model (Opus, Sonnet, Haiku) or adjust effort level.",
      "tags": ["settings", "model"],
      "docs": "https://code.claude.com/docs/en/commands"
    },
    {
      "id": "slash-compact",
      "category": "slash",
      "name": "/compact",
      "syntax": "/compact",
      "description": "Compress conversation history to free context window space while retaining key information.",
      "tags": ["context", "optimization"],
      "docs": "https://code.claude.com/docs/en/commands"
    },
    {
      "id": "slash-cost",
      "category": "slash",
      "name": "/cost",
      "syntax": "/cost",
      "description": "Show token usage and cost for the current session.",
      "tags": ["session", "cost"],
      "docs": "https://code.claude.com/docs/en/commands"
    },
    {
      "id": "slash-permissions",
      "category": "slash",
      "name": "/permissions",
      "syntax": "/permissions",
      "description": "View and manage tool permissions for the current session.",
      "tags": ["security", "permissions"],
      "docs": "https://code.claude.com/docs/en/commands"
    },
    {
      "id": "slash-config",
      "category": "slash",
      "name": "/config",
      "syntax": "/config",
      "description": "Open interactive settings menu to configure Claude Code preferences.",
      "tags": ["settings", "configuration"],
      "docs": "https://code.claude.com/docs/en/commands"
    },
    {
      "id": "slash-resume",
      "category": "slash",
      "name": "/resume",
      "syntax": "/resume",
      "description": "Show list of recent sessions and resume one by ID or name.",
      "tags": ["session", "navigation"],
      "docs": "https://code.claude.com/docs/en/commands"
    },
    {
      "id": "slash-memory",
      "category": "slash",
      "name": "/memory",
      "syntax": "/memory",
      "description": "View and manage CLAUDE.md files and auto-memory for the project.",
      "tags": ["memory", "instructions"],
      "docs": "https://code.claude.com/docs/en/commands"
    },
    {
      "id": "slash-rename",
      "category": "slash",
      "name": "/rename",
      "syntax": "/rename <name>",
      "description": "Set a display name for the current session.",
      "tags": ["session", "naming"],
      "docs": "https://code.claude.com/docs/en/commands"
    },
    {
      "id": "slash-agents",
      "category": "slash",
      "name": "/agents",
      "syntax": "/agents",
      "description": "List all configured subagents available in your project.",
      "tags": ["agents", "discovery"],
      "docs": "https://code.claude.com/docs/en/commands"
    },
    {
      "id": "slash-add-dir",
      "category": "slash",
      "name": "/add-dir",
      "syntax": "/add-dir <path>",
      "description": "Add additional working directories for file access within this session.",
      "tags": ["files", "permissions"],
      "docs": "https://code.claude.com/docs/en/commands"
    },
    {
      "id": "slash-desktop",
      "category": "slash",
      "name": "/desktop",
      "syntax": "/desktop",
      "description": "Hand off current session to Claude Code Desktop app for visual diff review.",
      "tags": ["desktop", "session"],
      "docs": "https://code.claude.com/docs/en/commands"
    },
    {
      "id": "slash-init",
      "category": "slash",
      "name": "/init",
      "syntax": "/init",
      "description": "Generate a CLAUDE.md file documenting your project structure and conventions.",
      "tags": ["setup", "documentation"],
      "docs": "https://code.claude.com/docs/en/commands"
    },
    {
      "id": "slash-upgrade",
      "category": "slash",
      "name": "/upgrade",
      "syntax": "/upgrade",
      "description": "Manage Claude Code subscription and plan upgrades.",
      "tags": ["account", "billing"],
      "docs": "https://code.claude.com/docs/en/commands"
    },
    {
      "id": "slash-login",
      "category": "slash",
      "name": "/login",
      "syntax": "/login",
      "description": "Sign in to your Claude account.",
      "tags": ["auth"],
      "docs": "https://code.claude.com/docs/en/commands"
    },
    {
      "id": "slash-logout",
      "category": "slash",
      "name": "/logout",
      "syntax": "/logout",
      "description": "Sign out from your Claude account.",
      "tags": ["auth"],
      "docs": "https://code.claude.com/docs/en/commands"
    },
    {
      "id": "slash-status",
      "category": "slash",
      "name": "/status",
      "syntax": "/status",
      "description": "Show current authentication status and account information.",
      "tags": ["auth", "account"],
      "docs": "https://code.claude.com/docs/en/commands"
    },
    {
      "id": "slash-mcp",
      "category": "slash",
      "name": "/mcp",
      "syntax": "/mcp",
      "description": "Manage Model Context Protocol servers connected to Claude Code.",
      "tags": ["mcp", "integrations"],
      "docs": "https://code.claude.com/docs/en/commands"
    },
    {
      "id": "slash-review",
      "category": "slash",
      "name": "/review",
      "syntax": "/review",
      "description": "Review a pull request and provide detailed feedback.",
      "example": "/review",
      "tags": ["review", "skill"],
      "docs": "https://code.claude.com/docs/en/commands"
    },
    {
      "id": "slash-hooks",
      "category": "slash",
      "name": "/hooks",
      "syntax": "/hooks",
      "description": "View and manage automation hooks in the current project.",
      "tags": ["hooks", "automation"],
      "docs": "https://code.claude.com/docs/en/commands"
    },
    {
      "id": "slash-keybindings",
      "category": "slash",
      "name": "/keybindings",
      "syntax": "/keybindings",
      "description": "Open or create keyboard shortcuts configuration file.",
      "tags": ["keyboard", "shortcuts"],
      "docs": "https://code.claude.com/docs/en/commands"
    },
    {
      "id": "slash-doctor",
      "category": "slash",
      "name": "/doctor",
      "syntax": "/doctor",
      "description": "Run diagnostics to identify configuration issues and suggest fixes.",
      "tags": ["debugging", "troubleshooting"],
      "docs": "https://code.claude.com/docs/en/commands"
    },
    {
      "id": "slash-voice",
      "category": "slash",
      "name": "/voice",
      "syntax": "/voice",
      "description": "Enable or configure voice dictation mode.",
      "tags": ["voice", "input"],
      "docs": "https://code.claude.com/docs/en/commands"
    },
    {
      "id": "slash-exit",
      "category": "slash",
      "name": "/exit",
      "syntax": "/exit",
      "description": "Exit Claude Code session.",
      "tags": ["session"],
      "docs": "https://code.claude.com/docs/en/commands"
    },
    {
      "id": "cli-claude",
      "category": "cli",
      "name": "claude",
      "syntax": "claude [query]",
      "description": "Start an interactive Claude Code session, optionally with an initial prompt.",
      "example": "claude \"explain this file\"",
      "tags": ["basics"],
      "docs": "https://code.claude.com/docs/en/cli-reference"
    },
    {
      "id": "cli-print-mode",
      "category": "cli",
      "name": "claude -p",
      "syntax": "claude -p \"<query>\"",
      "description": "Run a one-off query in non-interactive print mode and exit.",
      "example": "cat file.ts | claude -p \"find bugs\"",
      "tags": ["scripting", "automation"],
      "docs": "https://code.claude.com/docs/en/cli-reference"
    },
    {
      "id": "cli-continue",
      "category": "cli",
      "name": "claude -c / --continue",
      "syntax": "claude --continue",
      "description": "Resume the most recent conversation in the current directory.",
      "tags": ["session", "workflow"],
      "docs": "https://code.claude.com/docs/en/cli-reference"
    },
    {
      "id": "cli-resume",
      "category": "cli",
      "name": "claude --resume",
      "syntax": "claude --resume <id|name>",
      "description": "Resume a specific session by ID or name.",
      "example": "claude --resume auth-refactor",
      "tags": ["session", "workflow"],
      "docs": "https://code.claude.com/docs/en/cli-reference"
    },
    {
      "id": "cli-model",
      "category": "cli",
      "name": "claude --model",
      "syntax": "claude --model <model>",
      "description": "Override the model for this session (opus, sonnet, haiku, or full model ID).",
      "example": "claude --model opus",
      "tags": ["model", "configuration"],